Name,2016,2017,2018,2019,2020,2021,Latitude ,Longitude ,Content
Canada,169884504,137249292,141128903,153459635,155794218,190553919,58.33747,-112.384858,"Canada received the highest number of non-fillet fresh fish exports from the U.S. by a significant margin every year from 2016-2021. Canada and the U.S. share one of the largest trading relationships in the world, in part due to close cultural ties, and in part due to the North American Free Trade Agreement (NAFTA), which allows U.S. companies to ship qualifying goods to Canada or Mexico duty-free."
Japan,13890762,14483479,15120527,12143217,7716172,6777882,36.13793,138.441899,"The U.S. and Japan recently signed the U.S.-Japan Trade Agreement, which entered into force on January 1, 2020.  The relationship is important to the U.S. given its geopolitical interests in East Asia, and a majority of Japanese citizens consider the U.S. to be their closest ally."
France,4834652,4811246,3906919,2608400,1413960,797686,46.698481,2.549047,"France was a significant importer of American non-fillet fresh fish in 2016, but has since reduced its imports significantly. France is part of the European Union, which is one of the U.S.’s largest and most important trading partners.  While there is currently no dedicated free trade agreement between the U.S. and the EU, the U.S. remains the EU’s single largest trading partner."
Netherlands,3008016,2730479,2998335,2445787,2320529,2239456,52.554205,5.501896,"The Netherlands is part of the European Union, which is one of the U.S.’s largest and most important trading partners.  While there is currently no dedicated free trade agreement between the U.S. and the EU, the U.S. remains the EU’s single largest trading partner."
Mexico,34860281,14703982,21701069,13834652,10207201,12636180,23.920061,-102.289691,"Mexico was the second largest importer of American non-fillet fresh fish in 2016, but has since decreased its imports. Mexico is one of the U.S.’s largest trading partners for goods overall, in part due to proximity, and in part due to the North American Free Trade Agreement (NAFTA), which allows U.S. companies to ship qualifying goods to Canada or Mexico duty-free."
Nigeria,426883,14846125,11021226,24463100,20565181,16406945,9.404974,7.607418,Nigeria went from a relatively small importer of U.S. non-fillet fresh fish in 2016 to the second largest behind Canada in 2021.  Non-fillet fresh fish was the only industry in the OEC dataset where Nigeria was one of the top importers.
